[
  {
    "head": "无创正压通气早产儿喂养不耐受",
    "relation": "护理最佳证据",
    "tail": "体位管理（俯卧位或右侧卧位）、微量喂养、口腔刺激、非营养性吸吮可减少喂养不耐受发生",
    "source": "无创正压通气下早产儿喂养不耐受护理的最佳证据总结 2025",
    "evidence": "I级",
    "domain": "干预手段",
    "confidence": 0.9,
    "pmid": "",
    "update_date": "2026-05-08"
  },
  {
    "head": "无创正压通气早产儿",
    "relation": "喂养时机",
    "tail": "稳定期呼吸支持参数下可开始微量肠内喂养，喂养不增加呼吸做功",
    "source": "无创正压通气下早产儿喂养不耐受护理的最佳证据总结 2025",
    "evidence": "I级",
    "domain": "定义与诊断",
    "confidence": 0.85,
    "pmid": "",
    "update_date": "2026-05-08"
  },
  {
    "head": "早产儿出院后喂养",
    "relation": "随访管理共识",
    "tail": "中国医师协会新生儿科医师分会早产儿专业委员会发布《早产儿出院后随访与健康管理专家共识（2025）》",
    "source": "中华儿科杂志 2025",
    "evidence": "I级专家共识",
    "domain": "定义与诊断",
    "confidence": 0.95,
    "pmid": "",
    "update_date": "2026-05-08"
  },
  {
    "head": "早产儿出院后喂养",
    "relation": "营养随访指标",
    "tail": "体重、身长、头围增长速率，评估追赶生长情况与喂养耐受性",
    "source": "早产儿出院后随访与健康管理专家共识（2025）",
    "evidence": "I级专家共识",
    "domain": "评估方式",
    "confidence": 0.9,
    "pmid": "",
    "update_date": "2026-05-08"
  },
  {
    "head": "早产儿出院后",
    "relation": "喂养方案调整",
    "tail": "根据生长评估调整强化母乳或早产儿配方奶，矫正年龄6月内维持强化喂养",
    "source": "早产儿出院后随访与健康管理专家共识（2025）",
    "evidence": "I级专家共识",
    "domain": "干预手段",
    "confidence": 0.9,
    "pmid": "",
    "update_date": "2026-05-08"
  },
  {
    "head": "早产儿精细化管理",
    "relation": "参考指南",
    "tail": "参考《中华医学会围产医学分会早产儿管理指南（2022）》《美国儿科学会（AAP）早产儿保健指南》",
    "source": "早产儿精细化管理指南 2025",
    "evidence": "I级专家共识",
    "domain": "定义与诊断",
    "confidence": 0.85,
    "pmid": "",
    "update_date": "2026-05-08"
  }
]
