[
  {
    "head": "喂养不耐受评估",
    "relation": "推荐评分系统",
    "tail": "FI评分系统：评估呕吐、腹胀、胃残余量、血便4项指标，每项0-2分",
    "source": "PMC11079181 Feeding intolerance scoring system",
    "evidence": "I级",
    "domain": "评估方式",
    "confidence": 0.9,
    "pmid": "38654189",
    "update_date": "2026-05-08"
  },
  {
    "head": "胃残余量",
    "relation": "评估阈值",
    "tail": "前次喂养量的50%以上或>3ml/kg提示喂养不耐受",
    "source": "ESPEN/ESPGHAN早产儿营养指南 2024",
    "evidence": "I级",
    "domain": "评估方式",
    "confidence": 0.9,
    "pmid": "",
    "update_date": "2026-05-08"
  },
  {
    "head": "腹围监测",
    "relation": "评估方法",
    "tail": "每日测量脐部腹围，24h增加>2cm提示喂养不耐受",
    "source": "早产儿喂养不耐受非药物干预最佳证据总结 2023",
    "evidence": "I级专家共识",
    "domain": "评估方式",
    "confidence": 0.85,
    "pmid": "",
    "update_date": "2026-05-08"
  },
  {
    "head": "腹部X线检查",
    "relation": "适应证",
    "tail": "怀疑NEC或肠梗阻时，评估肠管扩张、气液平、胃肠道穿孔",
    "source": "NICE Guidelines / ESPGHAN 2024",
    "evidence": "I级专家共识",
    "domain": "评估方式",
    "confidence": 0.95,
    "pmid": "",
    "update_date": "2026-05-08"
  },
  {
    "head": "血常规",
    "relation": "评估指标",
    "tail": "WBC、CRP、降钙素原用于排除感染相关喂养不耐受",
    "source": "Frontiers in Pediatrics 2024",
    "evidence": "I级",
    "domain": "评估方式",
    "confidence": 0.85,
    "pmid": "39381698",
    "update_date": "2026-05-08"
  },
  {
    "head": "喂养不耐受",
    "relation": "粪便钙卫蛋白",
    "tail": "可作为肠道炎症标志物，升高提示肠道损伤",
    "source": "Nature Scientific Reports 2025",
    "evidence": "II级",
    "domain": "评估方式",
    "confidence": 0.8,
    "pmid": "39739912",
    "update_date": "2026-05-08"
  },
  {
    "head": "早产儿喂养不耐受评估",
    "relation": "综合评估工具",
    "tail": "包括症状评估（呕吐、腹胀）、生长指标（体重增长速率）、营养状态（血生化）",
    "source": "国家卫生健康委婴幼儿营养喂养评估服务指南 2024",
    "evidence": "I级专家共识",
    "domain": "评估方式",
    "confidence": 0.9,
    "pmid": "",
    "update_date": "2026-05-08"
  },
  {
    "head": "腹部超声",
    "relation": "评估价值",
    "tail": "评估肠壁厚度、血流灌注、蠕动功能，无辐射优于X线",
    "source": "ESPGHAN早产儿肠内营养指南 2024",
    "evidence": "II级",
    "domain": "评估方式",
    "confidence": 0.85,
    "pmid": "",
    "update_date": "2026-05-08"
  }
]
