[
  {
    "head": "早产儿经口喂养",
    "relation": "专家共识发布",
    "tail": "中国医师协会新生儿科医师分会循证专业委员会、中华儿科杂志编辑委员会发布《早产儿经口喂养临床实践专家共识（2025）》",
    "source": "中华儿科杂志 2025",
    "evidence": "I级专家共识",
    "domain": "定义与诊断",
    "confidence": 0.95,
    "pmid": "",
    "update_date": "2026-05-08"
  },
  {
    "head": "早产儿经口喂养",
    "relation": "启动时机",
    "tail": "矫正胎龄32-34周开始尝试经口喂养，伴有呼吸支持者需个体化评估",
    "source": "早产儿经口喂养临床实践专家共识（2025）",
    "evidence": "I级专家共识",
    "domain": "定义与诊断",
    "confidence": 0.9,
    "pmid": "",
    "update_date": "2026-05-08"
  },
  {
    "head": "早产儿经口喂养能力",
    "relation": "评估时机",
    "tail": "喂养前进行口腔运动评估，包括口腔反射（觅食、吸吮、吞咽）、口腔结构完整性",
    "source": "早产儿经口喂养临床实践专家共识（2025）",
    "evidence": "I级专家共识",
    "domain": "评估方式",
    "confidence": 0.9,
    "pmid": "",
    "update_date": "2026-05-08"
  },
  {
    "head": "早产儿经口喂养",
    "relation": "喂养过渡策略",
    "tail": "管饲→部分经口→完全经口三阶段过渡，根据矫正胎龄和临床表现调整",
    "source": "早产儿经口喂养临床实践专家共识（2025）",
    "evidence": "I级专家共识",
    "domain": "干预手段",
    "confidence": 0.9,
    "pmid": "",
    "update_date": "2026-05-08"
  },
  {
    "head": "早产儿经口喂养",
    "relation": "喂养效率评估",
    "tail": "记录每次喂养时间、摄入量、疲劳征象，评估指标包括喂养完成率、喂养时间、摄入百分比",
    "source": "早产儿经口喂养临床实践专家共识（2025）",
    "evidence": "I级专家共识",
    "domain": "评估方式",
    "confidence": 0.9,
    "pmid": "",
    "update_date": "2026-05-08"
  },
  {
    "head": "早产儿经口喂养",
    "relation": "失败指征",
    "tail": "呼吸暂停、心率下降、血氧饱和度下降、疲劳表现（出汗、嘴唇发绀）",
    "source": "早产儿经口喂养临床实践专家共识（2025）",
    "evidence": "I级专家共识",
    "domain": "评估方式",
    "confidence": 0.9,
    "pmid": "",
    "update_date": "2026-05-08"
  },
  {
    "head": "早产儿经口喂养",
    "relation": "环境要求",
    "tail": "安静环境、半斜坡卧位（30-45度）、非侵入性交互（避免过度刺激）",
    "source": "早产儿经口喂养临床实践专家共识（2025）",
    "evidence": "I级专家共识",
    "domain": "干预手段",
    "confidence": 0.9,
    "pmid": "",
    "update_date": "2026-05-08"
  },
  {
    "head": "早产儿经口喂养",
    "relation": "照顾者教育",
    "tail": "出院前培训家长识别喂养线索、正确喂养姿势、应急处理",
    "source": "早产儿经口喂养临床实践专家共识（2025）",
    "evidence": "I级专家共识",
    "domain": "干预后效果",
    "confidence": 0.85,
    "pmid": "",
    "update_date": "2026-05-08"
  }
]
